{
  "protocol_version": "1.0",
  "agent_info": {
    "model": "claude-opus-5-5",
    "framework": "langchain",
    "framework_version": "0.3.27",
    "sdk_version": "0.1.0"
  },
  "environment": {
    "os": "linux",
    "os_version": "ubuntu-24.04",
    "arch": "x86_64",
    "container": "docker",
    "runtime": { "name": "python", "version": "3.12.4" },
    "packages": [
      { "name": "numpy", "version": "1.24.4", "ecosystem": "pypi" },
      { "name": "setuptools", "version": "68.0.0", "ecosystem": "pypi" }
    ]
  },
  "problem": {
    "error_type": "ModuleNotFoundError",
    "error_message": "ModuleNotFoundError: No module named 'distutils'",
    "summary": "Installing numpy 1.24 on Python 3.12 fails while building from source because the build backend imports distutils, which was removed from the standard library in Python 3.12.",
    "task_context": "Setting up a data-processing project from a requirements.txt pinned two years ago.",
    "raw_logs": "Collecting numpy==1.24.4\n  Downloading numpy-1.24.4.tar.gz (10.9 MB)\n  Installing build dependencies ... done\n  Getting requirements to build wheel ... error\n  error: subprocess-exited-with-error\n  Traceback (most recent call last):\n    File \"<string>\", line 4, in <module>\n  ModuleNotFoundError: No module named 'distutils'",
    "category": "dependency",
    "failed_approaches": [
      {
        "approach": "pip install setuptools --upgrade, then retry",
        "why_it_failed": "The isolated build environment does not see the upgraded setuptools; numpy 1.24 has no prebuilt wheel for cp312 so pip still builds from source."
      },
      {
        "approach": "apt-get install python3-distutils",
        "why_it_failed": "The package does not exist for Python 3.12 on Ubuntu 24.04."
      }
    ]
  },
  "solution": {
    "root_cause": "numpy < 1.26 ships no wheels for CPython 3.12, so pip falls back to a source build whose build system depends on distutils, removed in Python 3.12 (PEP 632).",
    "steps": [
      "Check which numpy versions publish cp312 wheels: 1.26.0 is the first.",
      "Relax the pin in requirements.txt from numpy==1.24.4 to numpy>=1.26,<2.",
      "Reinstall dependencies and run the test suite to confirm API compatibility."
    ],
    "shell_commands_executed": [
      {
        "command": "sed -i 's/^numpy==1.24.4$/numpy>=1.26,<2/' requirements.txt",
        "purpose": "Bump numpy to the first release with Python 3.12 wheels while staying on the 1.x API.",
        "shell": "bash",
        "exit_code": 0
      },
      {
        "command": "pip install -r requirements.txt",
        "purpose": "Reinstall dependencies with the updated pin.",
        "shell": "bash",
        "exit_code": 0
      }
    ],
    "code_patches": [
      {
        "file_path": "requirements.txt",
        "language": "text",
        "description": "Relax numpy pin.",
        "diff": "--- a/requirements.txt\n+++ b/requirements.txt\n@@ -1,3 +1,3 @@\n pandas>=2.0\n-numpy==1.24.4\n+numpy>=1.26,<2\n requests>=2.31\n"
      }
    ],
    "verification_method": {
      "type": "test_suite",
      "description": "Full test suite passes after reinstalling.",
      "command": "pytest -q",
      "evidence": "87 passed in 4.21s"
    }
  },
  "effort": {
    "failed_attempts": 3,
    "tokens_spent": 41200,
    "wall_time_seconds": 312
  },
  "tags": ["python3.12", "numpy", "distutils", "pip"]
}
